{
  "$schema": "https://json-schema.org/draft-07/schema#",
  "title": "App Manifest",
  "type": "object",
  "required": ["id", "name", "description", "category", "icon", "access"],
  "properties": {
    "id": { "type": "string", "pattern": "^[a-z0-9-]+$" },
    "name": { "type": "string", "minLength": 1 },
    "description": { "type": "string", "minLength": 1 },
    "category": {
      "type": "string",
      "enum": [
        "Gestion",
        "Production",
        "RH",
        "Finance",
        "Qualité",
        "Logistique",
        "Commercial",
        "IT"
      ]
    },
    "icon": { "type": "string", "minLength": 1 },
    "access": {
      "type": "object",
      "oneOf": [
        {
          "required": ["type", "url"],
          "properties": {
            "type": { "const": "redirect" },
            "url": { "type": "string", "format": "uri" }
          }
        },
        {
          "required": ["type", "composeFile", "serviceName", "internalPort"],
          "properties": {
            "type": { "const": "docker" },
            "composeFile": { "type": "string" },
            "serviceName": { "type": "string" },
            "internalPort": { "type": "integer", "minimum": 1, "maximum": 65535 },
            "healthUrl": { "type": "string", "format": "uri" }
          }
        }
      ]
    },
    "roles": { "type": "array", "items": { "type": "string" } }
  }
}
