{
  "$schema": "../../schemas/app-manifest.json",
  "id": "stocks",
  "name": "Gestion des stocks",
  "description": "Inventaire, mouvements et seuils de réapprovisionnement",
  "category": "Logistique",
  "icon": "Package",
  "access": {
    "type": "redirect",
    "url": "https://erp.isb-group.fr/stocks"
  },
  "roles": ["logistics.manager", "logistics.operator"]
}
